Reviews,cleaned_review,cluster
"I played toca life since 2018 and Avatar world is one of the best games I played in my life there are a whole lot of places to visit and I don't have to pay a single cent to get all of those places, every single while they add new and fun stuff, and there are free gifts every single thing comes out!!! Big gifts,to be exact! When there is an event that comes out, there are big boxes with DECORATIONS , and cars,something that toca world dosent have. Overall. This gam is great. FIVE STARS!!!",played toca life since 2018 avatar world one best game played life whole lot place visit dont pay single cent get place every single add new fun stuff free gift every single thing come big giftsto exact event come big box decoration carssomething toca world dosent overall gam great five star,0
"Full transparency, I'm a 17 year old who grew up with Toca World. This app is 1,000x better. It has a cute artstyle, fun little mini games, and a whole world to explore, without spending a penny. It also has hidden items and puzzles, and, no joke, I will spend HOURS figuring them out. There are some that I haven't managed to get yet. They update regularly, have free holiday stuff, and way more to do than any other game I've tried like this. Keep up the good work!!",full transparency im 17 year old grew toca world app 1000x better cute artstyle fun little mini game whole world explore without spending penny also hidden item puzzle joke spend hour figuring havent managed get yet update regularly free holiday stuff way game ive tried like keep good work,0
"Totally amazing! My daughter and I absolutely LOVE this game!! There's a TON of super cool FREE locations and items with fun animations, as well as a paid monthly pass that adds even more at a great price/value! They're really quick to fix bugs, and keep updating the game experience in a very positive way. I'm so impressed! I'd originally thought it was simply a Toca Boca World clone (it's not), but it surpasses as far as bug fixes (big problem with Toca), updates and free content. Exceptional ⭐",totally amazing daughter absolutely love game there ton super cool free location item fun animation well paid monthly pas add even great pricevalue theyre really quick fix bug keep updating game experience positive way im impressed id originally thought simply toca boca world clone surpasses far bug fix big problem toca update free content exceptional,0
"I love the game so much!! So much to do and so many episodes u could do, but there so problems that I have to deal with there's many bugs and it takes me put of the game for no reason avatar world please fix it. And one for thing we have to buy the nice stuff I know you guys need money to upgrade it but please make some of the pack free some players may agreed too but this is in my opinion please avatar world check this message out! But it's a really great game!! And I love it!",love game much much many episode u could problem deal there many bug take put game reason avatar world please fix one thing buy nice stuff know guy need money upgrade please make pack free player may agreed opinion please avatar world check message really great game love,0
"I actually really love this game. No ads tons of free stuff with regular updates that include new options and sometimes gameplay. I genuinely get overwhelmed by just how much stuff I can play with. I bought a few dlcs but unlike other games I didn't feel that pressure to buy to enjoy the game. The free no ad version is amazing. I continue to be amazed by the stuff you can do, how you can dress up and decorate but also by the updates. ALL FOR FREE with NO ADS! I'd love to get another console game",actually really love game ad ton free stuff regular update include new option sometimes gameplay genuinely get overwhelmed much stuff play bought dlcs unlike game didnt feel pressure buy enjoy game free ad version amazing continue amazed stuff dress decorate also update free ad id love get another console game,0
"I cannot withstand the magical simulation in this game. It really let's people show who they are. I've played Toca boca, but it isn't as kawaii as this one! This game is the one and only best avatar simulation game! I highly recommend playing this game. And another thing: you can change the style of the music and I LOVE the new city! If I could, I would rate this infinity ♾️ stars! I love how there is even a cool movie 🎬 studio 🎙 and a movie theater! This game is a must play!💙",cannot withstand magical simulation game really let people show ive played toca boca isnt kawaii one game one best avatar simulation game highly recommend playing game another thing change style music love new city could would rate infinity star love even cool movie studio movie theater game must play,0
Really good game love art style I made a story cuz I have a mind that makes story's with stuff somehow🤣 love the puzzles and locked items I spend HOURS I MEAN HOURS! To get the unlocked but some things I can't figure out but don't worry that's the fun part 😊 but the problem is sometimes it's glitchy and has a lot of ads when it glitches out 😕 and it gets boring sometimes like real boring 😞 it's so boring and the pet maker update doesn't work! Cute tho! 🥰,really good game love art style made story cuz mind make story stuff somehow love puzzle locked item spend hour mean hour get unlocked thing cant figure dont worry thats fun part problem sometimes glitchy lot ad glitch get boring sometimes like real boring boring pet maker update doesnt work cute tho,0
"It's really fun! I used to play toca but I had to pay for all the locations and I'm broke lol it's super detailed and I love the animations you added it so much easier to take off bags and coats now! I think it would so cool if you added more style clothing options like grunge, street wear and goth! It would help so many people make stories especially if they make videos but other then that it's super cool and fun to play. I even got my cousin to play and she never plays these types of games!",really fun used play toca pay location im broke lol super detailed love animation added much easier take bag coat think would cool added style clothing option like grunge street wear goth would help many people make story especially make video super cool fun play even got cousin play never play type game,0
"Everything said about this game is true, the amazing animation quality, cute style, versatile clothing up to date with today's fashion, cheaper price for asthetic bundles and much more but as all these pros together I have one thing to clear up. On certain events clothing around the map alters and in the stores you get to utilize the free clothing displayed on the mannequin this is awesome but a new event came and it stop stocking the previous clothing on the mannequin its gone forever",everything said game true amazing animation quality cute style versatile clothing date today fashion cheaper price asthetic bundle much pro together one thing clear certain event clothing around map alters store get utilize free clothing displayed mannequin awesome new event came stop stocking previous clothing mannequin gone forever,0
"Avatar world is a fun game to play to me because of how many new things there are. For instance, there is a new update every week or so making it very exciting. And so far, there are TWO new islands with cool new things. And they have new clothes every week! It changes all the time! And you can play with four friends online or offline. You can also get free things in the store. So I like this game because of how much it changes. It is amazing and I love it sooooo much! I hope you do to. Love it!",avatar world fun game play many new thing instance new update every week making exciting far two new island cool new thing new clothes every week change time play four friend online offline also get free thing store like game much change amazing love sooooo much hope love,0
"The game is super fun and it dosent cost anything to buy the game but you can buy stuff in the game. I hope you can enjoy this game like I did when I got it. Basically it's like toca boca but way more realistic. Note to the game 🎮 you gotta have way more character slots, atleast 5 and here's my reason why: everybody has been asking for more slots so please 🙏 fix this. But I would give this game a 5 star wonce you play it. I mean it does get a little boring after a little while, but 5 stars",game super fun dosent cost anything buy game buy stuff game hope enjoy game like got basically like toca boca way realistic note game gotta way character slot atleast 5 here reason everybody asking slot please fix would give game 5 star wonce play mean get little boring little 5 star,0
"This game is amazing! I love it so much! Thank you, Pazu for doing such a good job! I'm always excited for new updates, and I never disliked any of the updates. New places, new free stuff, new clothes, and so, so much more! They're always so cool and make me want to play more. The star dust city update might be my favorite! But, can you make more free stuff? I played it on the iPad in 2023, but my sister wanted it, so I tried to find it on my computer. The holiday and season free packs are gone.",game amazing love much thank pazu good job im always excited new update never disliked update new place new free stuff new clothes much theyre always cool make want play star dust city update might favorite make free stuff played ipad 2023 sister wanted tried find computer holiday season free pack gone,0
"This game is amazing, I love all the graphics, but recently, I've bought a couple of packs and within 2 months, the pack I bought is gone. And I'm spending good money,I don't have time or energy to waste money on packs now. My house is reseting, and my characters are missing. If these issues keep accuring, I may have to stop playing Avatar world altogether if these bugs keep on happening during my role play experience. Please fix this as soon as possible for my better game play.",game amazing love graphic recently ive bought couple pack within 2 month pack bought gone im spending good moneyi dont time energy waste money pack house reseting character missing issue keep accuring may stop playing avatar world altogether bug keep happening role play experience please fix soon possible better game play,0
"I am absolutely obsessed with Pazu Avatar World! This game is literally the coolest thing I've ever played, with stunning graphics, fun gameplay, and blissful features nd new updates. I mean, what's not to love? I can play it whenever I want, wherever I want, and it's just the best feeling. But, I've a few suggestions for a cruise, apartment building or complex nd a season option, changeable acc to our choice. Pazu team, you've got to do smth about this! Overall, I simply love this game! 💓🤍",absolutely obsessed pazu avatar world game literally coolest thing ive ever played stunning graphic fun gameplay blissful feature nd new update mean whats love play whenever want wherever want best feeling ive suggestion cruise apartment building complex nd season option changeable acc choice pazu team youve got smth overall simply love game,0
"Avatar World: Games for Kids is a fun, creative game for ages 5–12. Players design characters, explore colourful environments, and create stories. It’s visually appealing and kid-friendly but needs more luxurious houses, apartments, furniture, and places like museums, hospitals, etc. Adding better clothes for boys and girls need more clothes for boys, fixing glitches, and making all features free would improve it. Great for casual play, but repetitive over time. Rating: 5/5.",avatar world game kid fun creative game age 512 player design character explore colourful environment create story visually appealing kidfriendly need luxurious house apartment furniture place like museum hospital etc adding better clothes boy girl need clothes boy fixing glitch making feature free would improve great casual play repetitive time rating 55,0
"It's is a good game! I play this game whenever I get bored. However, I really love that you guys will add another shop or something, more free items and also the character creator, I really wanted to make a family of four, but I only have 3 slots in my character creator. And also in the character creator,i also wanted more designs, hairs, eyes etc. The hairs for me is just a bit boring. Anywaysss, that's all! This game really cures my boredom and yes I rlly like it a lot, and once again, I'm out",good game play game whenever get bored however really love guy add another shop something free item also character creator really wanted make family four 3 slot character creator also character creatori also wanted design hair eye etc hair bit boring anywaysss thats game really cure boredom yes rlly like lot im,0
This game is awesome! I also really like the water park update. This game is soo good and I really like the avatars too. Just plz add more colour wheel things on more pieces of items. And thx Avatar World creators and I rate it 5 stars. Like best app ever! Just 1 problem. When I wanted to get out a characters 2 mens clothes changed and their mouths were just a black line and for the women her eyes was just a black block and it made my bum feel weird and I was shocked.,game awesome also really like water park update game soo good really like avatar plz add colour wheel thing piece item thx avatar world creator rate 5 star like best app ever 1 problem wanted get character 2 men clothes changed mouth black line woman eye black block made bum feel weird shocked,0
"It's a great game!! I've been playing it for about a year now. But there's two things i don't like about it, #1: Everytime it needs an update, you have to delete half the apps I already have. #2: just a suggestion, but you should definitely add more toys to the baby shop! Things like mabye.. baby bouncers, toy blocks, you know! Things other than stuffed animals. Don't get me wrong, kids LOOOOVE stuffed animals, but not THAT much. Evertime a play, I have to steal toys from the daycare 😅 thanks!",great game ive playing year there two thing dont like 1 everytime need update delete half apps already 2 suggestion definitely add toy baby shop thing like mabye baby bouncer toy block know thing stuffed animal dont get wrong kid loooove stuffed animal much evertime play steal toy daycare thanks,0
"So I've been playing avatar world for over two years. I do content about it on YouTube, and I the game is really fun and easy to use. There are some bugs, but in every update they get fixed. There's an update almost every week.Overall I love this app the characters are great, but avatar world could add three more character slots so people don't have to buy the pack. If they could add some more free packs that would be very nice, because you have to buy packs. Anyways, it's rly great, 5 stars.💗",ive playing avatar world two year content youtube game really fun easy use bug every update get fixed there update almost every weekoverall love app character great avatar world could add three character slot people dont buy pack could add free pack would nice buy pack anyways rly great 5 star,0
It's a good game but it needs aittle adjustment and U can get everything for free without buying it and its very fun for me and I'm happy we can make multiplayer games with our friends and I like it how other ppl can design our house and move items .it's not a bad game for mostly. Every one. I enjoy playing this game with my friends and ppl who I know and there other games that copy avatar worlds hard work and design it's my destiny to see the people who made this game and im so proud avatar❤,good game need aittle adjustment u get everything free without buying fun im happy make multiplayer game friend like ppl design house move item bad game mostly every one enjoy playing game friend ppl know game copy avatar world hard work design destiny see people made game im proud avatar,0
"This is a app a bit like toca Boca. It's a good game I'm not going to lie. Has some cute characters, places, pets and more!!! It doesn't malfunction that much. It's great. The thing is I can't find the right clothes to wear :'). Please add clothes with aren't really kiwaii, nor drip, But please do something from the flower shop. i.love.the.flower.shop.a.lot. it's got a cute little aesthetic which gives my characters their personality. Thank you so much for reading avatar word! Love y'all "".•~`°",app bit like toca boca good game im going lie cute character place pet doesnt malfunction much great thing cant find right clothes wear please add clothes arent really kiwaii drip please something flower shop ilovetheflowershopalot got cute little aesthetic give character personality thank much reading avatar word love yall,0
"When I first downloaded Avatar world for my kid on a road trip I was a bit skeptical.. but then after a few weeks my kid has been sitting still and not being his usual hyperactive self!! This saved me big time since I was new to parenting and it was alot easier since well of Toca Boca, my kid used to like playing Toca Boca but since it had alot of things you had to buy I just stood to this one because 1. There's alot up updates, 2. Better avatar choices, and 3. Because it has alot of free items!",first downloaded avatar world kid road trip bit skeptical week kid sitting still usual hyperactive self saved big time since new parenting alot easier since well toca boca kid used like playing toca boca since alot thing buy stood one 1 there alot update 2 better avatar choice 3 alot free item,0
The game is loads of fun u can do a lot but u can only play up to like 30 mins and then the game stops and a subscription add pops up and u cant play other than that its really fun and i think the creators did a great Job ( edit here) so basically it's one of the best games in the world I can't stop playing it Beautiful I love all the new updates and clothes I wish younguys would give us some more access too the packs tho they look amazing and not all of us can afford it but other than that ❤,game load fun u lot u play like 30 min game stop subscription add pop u cant play really fun think creator great job edit basically one best game world cant stop playing beautiful love new update clothes wish younguys would give u access pack tho look amazing u afford,0
"This game is very great,I just wish they could add more realistic things,like the entire process of getting pregnant and the 9 months thing and the birth of the baby.and I wish the hospital was more realistic and a lot bigger maybe like 5 floors bigger,but yeah I wish that they would add a lot more realistic things,If they would that would make the game a whole lot better,but overall this is a really good game,and after Roblox and Minecraft,this is my favorite game.I hope this helps,goodbye.👋",game greati wish could add realistic thingslike entire process getting pregnant 9 month thing birth babyand wish hospital realistic lot bigger maybe like 5 floor biggerbut yeah wish would add lot realistic thingsif would would make game whole lot betterbut overall really good gameand roblox minecraftthis favorite gamei hope helpsgoodbye,0
"I started playing Avatar World since the first time,and I'm glad for it. I played lot's of games like this,but nowone was like Avatar World. In my class we have a team of players of this game,and it's pretty fun playing and talking about it. Avatar World it's 💯 free,not like other games..... Yeah,it's true it could take money if you want to payextra things. There are lots of updates per week,and believe me,there are great. I need to say,that I love Avatar World. Love you AW team🥰🥰.",started playing avatar world since first timeand im glad played lot game like thisbut nowone like avatar world class team player gameand pretty fun playing talking avatar world freenot like game yeahits true could take money want payextra thing lot update per weekand believe methere great need saythat love avatar world love aw team,0
"It's nice but it gets a little boring you know, but I still like it it's amazing for kids to play. I'm impressed that Pazu made this amazing game. Good job! I love the avatars it's super cute. And the places are amazingly awesome. You guys don't know how amazed that I am!As you know, When I first started the game, it was boring. But now that I know what to do, it's getting way fun! I've been playing this since 2024. I love it VERY much♡ Thank you Pazu for making this! Everyone loves you!!!!",nice get little boring know still like amazing kid play im impressed pazu made amazing game good job love avatar super cute place amazingly awesome guy dont know amazed amas know first started game boring know getting way fun ive playing since 2024 love much thank pazu making everyone love,0
"I'm preslee nen thisgame is my ultra fav game you have to install it it is super duper nice there is no glitches, adds, 4 players can play with each other and you don't need network,it doesn't need network connection I played this game from 2022 and I am ngl it inspires me with every update and now in 2025 there are 3 city's Which are fully complete only stardust city they are working on it even more do not listen to haters for this game listen to me you will have the best game experience ever",im preslee nen thisgame ultra fav game install super duper nice glitch add 4 player play dont need networkit doesnt need network connection played game 2022 ngl inspires every update 2025 3 city fully complete stardust city working even listen hater game listen best game experience ever,0
"I feel like it's a great game but to update it you have to delete like four apps or else you'll just play it like that but it's a good game. I recommend you to buy it only if you're willing to delete some of your apps. I feel like older kids and younger kids can play it and it won't bother them.12 year olds can play it, 11 year olds can play it, 7 year olds can play it. That's why I like it.",feel like great game update delete like four apps else youll play like good game recommend buy youre willing delete apps feel like older kid younger kid play wont bother them12 year old play 11 year old play 7 year old play thats like,0
"LOVE EVERY SINGLE UPDATE,this game is fun and entertaining when your bored plus you can EVEN PLAY IT WITHOUT WIFI The best part about this game is,it's appropriate, it's good for roleplays,and you can play hours and you won't get bored,there is one problem tho..my world randomly resets,so I hope avatar world fix's this issue,cuz it happens to me sometimes,and maybe some people experience that too,and there is another issue of people disappearing so I hope avatar world fix's this issue,thats all!",love every single updatethis game fun entertaining bored plus even play without wifi best part game isits appropriate good roleplaysand play hour wont get boredthere one problem thomy world randomly resetsso hope avatar world fix issuecuz happens sometimesand maybe people experience tooand another issue people disappearing hope avatar world fix issuethats,0
"I am 19 years old, and I still play this game. It has been two years since I started playing because I find Avatar World really cute and interesting, especially since I love girly things. I don’t have any problems with the game, but I have a few suggestions. Could you add more hairstyles for both boy and girl characters? Also, could you add more character options, like a teenager—tall, thin, with an average-sized head, similar to an anime character?",19 year old still play game two year since started playing find avatar world really cute interesting especially since love girly thing dont problem game suggestion could add hairstyle boy girl character also could add character option like teenagertall thin averagesized head similar anime character,0
I love avater world you don't got to pay alot of money to have fun the only thing that cost money is for the characters and furniture packs and that's just it also has fun puzzles that are very interesting and fun that take a lot of time to do and you don't need WiFi to play if your bored on a road trip or somewhere this is the best game to get and finally the game updates daily and has great updates if you want a game like toca Boca this is the best option and it's even better than toca Boca!!!,love avater world dont got pay alot money fun thing cost money character furniture pack thats also fun puzzle interesting fun take lot time dont need wifi play bored road trip somewhere best game get finally game update daily great update want game like toca boca best option even better toca boca,0
I love Avatar. Avatar glitch suit was so disappointed. I couldn't have enjoyed myself but I rated it. I love the house maker I love things but I didn't have that money. My cousin and I and my friends Android to play with me but one thing. There is a hair salon house maker. It is so fun that I couldn't know what to do. I was so excited. No one never know is coming up. But I know club the girl that always love to play club toy and she is on YouTube. Typing her. And you will see what will happen.,love avatar avatar glitch suit disappointed couldnt enjoyed rated love house maker love thing didnt money cousin friend android play one thing hair salon house maker fun couldnt know excited one never know coming know club girl always love play club toy youtube typing see happen,0
