Reviews,cleaned_review,cluster
Avatar real is the most bestest game I ever seen in my life it is so fun and nice that every time it upgraded I am so happy because I get a new upgraded fun stuff right now outdoors now giving away the pets and I'm so happy because I can read to my pet Avatar and thank you very much Avatar world thank you very much avatara you guys please say you like the star please give us a 5-star because it's so nice and I found that you know anybody want to play this game bye and thank you for reading my be,avatar real bestest game ever seen life fun nice every time upgraded happy get new upgraded fun stuff right outdoors giving away pet im happy read pet avatar thank much avatar world thank much avatara guy please say like star please give u 5star nice found know anybody want play game bye thank reading,0
I can't believe what I saw is this world or something I like this so much but just one just one is their characters are like 5it is nice I like they're all everything I like it is my always favourite thank you so much and first in 2023 and not much development now it become as my favourite game thank you so much other full four giving this much nice I wish you a game will go continue and it will become a most popular game in the world and that's,cant believe saw world something like much one one character like 5it nice like theyre everything like always favourite thank much first 2023 much development become favourite game thank much full four giving much nice wish game go continue become popular game world thats,0
"It's a great game for kids and teens for roleplays and solving secrets and customising characters and houses but I would love if you add free characters and Free house decor and police station and prisons and more Male clothes and make the NPCs move from one place to another . Please send me the pazu box , I really want to be one of the winners 😁.I have been playing on phone since 2022, and can you please add more free furniture,and yes if you're wondering I'm Indian.Keep up the effort:). Asia.",great game kid teen roleplays solving secret customising character house would love add free character free house decor police station prison male clothes make npc move one place another please send pazu box really want one winner playing phone since 2022 please add free furnitureand yes youre wondering im indiankeep effort asia,0
it's nothing like talk about her it feels like you never missing out it's just like the best game to play Toca Boca you had to buy everything here you just get the Mansions and everything with with just updating it so this is why I love it and plus I'm a kid I still so I'm I am so happy that I didn't have to ask my parents to buy me these things and I didn't get to miss out but still I did miss out on a bit but it wasn't as much as talk about her you only got a small house and we get all,nothing like talk feel like never missing like best game play toca boca buy everything get mansion everything updating love plus im kid still im happy didnt ask parent buy thing didnt get miss still miss bit wasnt much talk got small house get,0
"This is really good since I've came back. They added the sunset, detailed the sun and moon, and added a customization of pets! But one thing I want Avatar World to add is more eye options, hair, (Front, back, and mustaches) mouths, clothes, accesories, and free customization of hair color. Although it's really good, it hasn't really changed a ton but it's still good",really good since ive came back added sunset detailed sun moon added customization pet one thing want avatar world add eye option hair front back mustache mouth clothes accesories free customization hair color although really good hasnt really changed ton still good,1
"So this is my first review! If I could give decimal numbers for ratings, I'd give it about a 4.5. It's a cute game with in app purchases that aren't major but would probably help increase your desire to play. Everything is swell but you can't move furniture upstairs, the free furniture is LACKING. And for some strange reason, you can only use like about 20 characters on all maps. I like this game but I feel that the reading between the lines is a plea to spend money. Fix this please! Thank you!!",first review could give decimal number rating id give 45 cute game app purchase arent major would probably help increase desire play everything swell cant move furniture upstairs free furniture lacking strange reason use like 20 character map like game feel reading line plea spend money fix please thank,1
"I've been a big fan of this game since 2024, and I really appreciated that you didn't require players to pay for everything to get cute items or other fun stuff. However, since Christmas, I've noticed that some features, like new houses, furniture, themes, and bundles, seem to be locked behind a paywall. I'm not trying to criticize, but I miss the days when those things were more accessible.",ive big fan game since 2024 really appreciated didnt require player pay everything get cute item fun stuff however since christmas ive noticed feature like new house furniture theme bundle seem locked behind paywall im trying criticize miss day thing accessible,1
"Love this game but I would like if you added a thing where you could take off socks, shoes, bags, bracelets, etc. also I don't like how you can't rotate furniture I would also like if you could put more clothing shops too also I don't like how in the new restaurant you dont have food but like that's all I think that it need a little more buildings as well but I highly recommend this app it is so fun to play in I love that you can play with your friends on 4 different devices.",love game would like added thing could take sock shoe bag bracelet etc also dont like cant rotate furniture would also like could put clothing shop also dont like new restaurant dont food like thats think need little building well highly recommend app fun play love play friend 4 different device,1
"Tbh I love this game but I'm sad there used to be a glitch where you can take someone's clothing off of them and then leave the building and come back, and the clothes would be back on the person you took them from, and you'd still have those items. Another problem for me is the spacing between updates for the pazu plus subscription? I thought it was every specific number of days but it's turning out to be quite random and id like to be able to look forward to a set update. Love it! 🩷",tbh love game im sad used glitch take someone clothing leave building come back clothes would back person took youd still item another problem spacing update pazu plus subscription thought every specific number day turning quite random id like able look forward set update love,1
"Love the app, it's really fun, but I think there could be a few things added and a few things fixed. First of all, I made a baby room in one of the custom houses, and nost times it won't let me grab the baby clothes unless I go in furniture moving mode for some reason. Was hoping that could get fixed. And second, I think a few more everyday buildings could be added. Such as a gym, a police station/jail, and maybe a court room?? Also, the updates take up a lot of space.Pls fix/add these things!!❤",love app really fun think could thing added thing fixed first made baby room one custom house nost time wont let grab baby clothes unless go furniture moving mode reason hoping could get fixed second think everyday building could added gym police stationjail maybe court room also update take lot spacepls fixadd thing,1
"I like the game, but you completely forgot the bus update?! All places are free and I highly recommend!!! Great game! Updated: I really wish that there where at least 5 more free character slots bc I don't want to by a pack that has 30 bc that's a lot of slots for me. Or just the option to get a gift pack that ads 5 or so more. Pls take this into consideration!!!😁😁😁*** Maybe a extra good car*** have a wonderful day and God bless you all",like game completely forgot bus update place free highly recommend great game updated really wish least 5 free character slot bc dont want pack 30 bc thats lot slot option get gift pack ad 5 pls take consideration maybe extra good car wonderful day god bless,1
"I really like this game. A few problems though. My stuff keeps disappearing, some of my game has glitched (My character appears with no pupils and once without a head, and often one of my toddler characters has eyes the are super thin, so it looks like their eyes are wide and short), and sometimes (in the bubble glam house) there is a pot for kitchen things, I put it in a cabinet, and now I cannot get it out of the cabinet, even when I open it and try to take it out. Can you fix these?",really like game problem though stuff keep disappearing game glitched character appears pupil without head often one toddler character eye super thin look like eye wide short sometimes bubble glam house pot kitchen thing put cabinet cannot get cabinet even open try take fix,1
"I love this game but there is a HUGE issue, there's a few things I would like added to the game like multiple saves and stuff but the largest problem here is that ITEMS KEEP DISAPPEARING! I have a character who's clothes all completely disappeared randomly TWICE! There's only so many clothes I can find in her style within this game. This needs to be fixed I beg😭 also I would love if there was a way to get old store items I missed (or that have disappeared) again",love game huge issue there thing would like added game like multiple save stuff largest problem item keep disappearing character who clothes completely disappeared randomly twice there many clothes find style within game need fixed beg also would love way get old store item missed disappeared,1
"I totally love this game it's a blast but please can there be more avatar slots for those who can't get extension packs or let's be able to add in game characters to our characters and can there be more hair choices in the salon. Also if possible there should be more hair colours like brown and black, toddlers should be able to use the salon . The salon should be updated with more hair . We would also like an upgraded hospital . Still waiting on the purple bus icon and green room in the daycare.",totally love game blast please avatar slot cant get extension pack let able add game character character hair choice salon also possible hair colour like brown black toddler able use salon salon updated hair would also like upgraded hospital still waiting purple bus icon green room daycare,1
"I love it. It is perfect for cartoon and there are loads of updates happening like every day. The only problem is, is that it's quite glitchy and I have to keep restarting the world. Otherwise than that. It is amazing and not that expensive. Free to play and there is a decent amount of free things in the shop. You can make decent things without money. I'm never gonna be to old for this.Also I want to ask the owner if they can add a collage or like a higher age school bc it is very hard to make.",love perfect cartoon load update happening like every day problem quite glitchy keep restarting world otherwise amazing expensive free play decent amount free thing shop make decent thing without money im never gonna old thisalso want ask owner add collage like higher age school bc hard make,1
I'm in love with this app!!! I love how you can join ur friends servers and look at there houses! I recommend this it's a very good app it has no glitches and no WiFi!!! But the one problem is that you can only have 3 characters. It would be amazing if you.could at least have around 5 or six. Please add more characters and also when I try but something next to the wall it makes me to put it half in the middle of the room fix that pls. Overall it's a very great app recommend it! Damload it now,im love app love join ur friend server look house recommend good app glitch wifi one problem 3 character would amazing youcould least around 5 six please add character also try something next wall make put half middle room fix pls overall great app recommend damload,1
"I love this game, it's free and you don't need to pay to access other places. I'd rate it 5 stars but I have just one problem with it and it's the hosting a world feature where you and your friend can play together in one world, I love everything about it but I just hope that the progress we've made could save because my friend and I decided to play together in my world and she customized her house there. We were absolutely disappointed to see that the progress we've made wasn't saved.",love game free dont need pay access place id rate 5 star one problem hosting world feature friend play together one world love everything hope progress weve made could save friend decided play together world customized house absolutely disappointed see progress weve made wasnt saved,1
"I think it deserves 5 stars but,the packs are a bit pricey,maybe you should make them a bit cheaper or make some free. This is just an idea because some people can't afford the packs they would like. I like how all locations are free. Character customization is good but i think you should add more clothing,also more for baby's. I think you should add more free character slots atleast 5 or 6 slots. Also in my opinon i think there should be more places in the holiday areas.",think deserves 5 star butthe pack bit priceymaybe make bit cheaper make free idea people cant afford pack would like like location free character customization good think add clothingalso baby think add free character slot atleast 5 6 slot also opinon think place holiday area,1
"I love this! Please add a account for data saves because I deleted my aw once. Account ; google apple or some apps that apply emails! Love this game, I also made big bang with it, I don't buy some packs because we are too poor but not that homeless just only normal:) Rated 5! Make a free pack again but this time the bubble glam only once pleasee! I been playing this for 2 year but I lost my phone that's why I'm still playing it. Love it! ❤💖",love please add account data save deleted aw account google apple apps apply email love game also made big bang dont buy pack poor homeless normal rated 5 make free pack time bubble glam pleasee playing 2 year lost phone thats im still playing love,1
"This game? wow! I've been playing this game for 2 years ahead, and it been my fave games to play. I luv the update, I luv it all! the dress up, the houses, it also has realistic logics like walking, paying stuff and car! how cool is that? but there's two thing, TWO thing I don't like:( it doesn't even save my work and it keep bugging, I know the others is fine and all cool, but mine? It's extremely bugging! please pazu, please fix this!! if you did, thank you very much! (my daughter's writing)",game wow ive playing game 2 year ahead fave game play luv update luv dress house also realistic logic like walking paying stuff car cool there two thing two thing dont like doesnt even save work keep bugging know others fine cool mine extremely bugging please pazu please fix thank much daughter writing,1
"Amazing . Better than Toca Boca. Unlike other games, you don't have to pay to get things. Most of the places are free. But could we have 5 characters, then 3, please. Omg I had these reset buttons om my screen on every building and I pressed a few to later on be told that I reset some building and reset my stuff but I need to undo that. I am having a heart attack now. Can you please put a undo button. Also can you make it not need to update all the time bc I deleted all my other games",amazing better toca boca unlike game dont pay get thing place free could 5 character 3 please omg reset button om screen every building pressed later told reset building reset stuff need undo heart attack please put undo button also make need update time bc deleted game,1
"I give it a five star but sometimes it glitches please fix it but amazing game 👍 I love the game Soo much I play it every day but sometimes my things disappear and re-appear ×2. And some times I find it annoying cause whenever I go to the airport I find other characters holding a box of my clothes and items😅 and also please make more Avatar slots from 3 to 4 even though, I give it a 5 star rating pazu like WHY isn't the new update available on Android and available on apple. That isn't fair 😔",give five star sometimes glitch please fix amazing game love game soo much play every day sometimes thing disappear reappear 2 time find annoying cause whenever go airport find character holding box clothes item also please make avatar slot 3 4 even though give 5 star rating pazu like isnt new update available android available apple isnt fair,1
"I have had this app/game for like 2-3 years and I LOVE IT! Although I have a lot of suggestions such as maybe add a hospital, hopefully more clothing stores and if you could pleasw finish off the apps on the phone that would be amazing, as well as adding mor characters onto the phone thing and please get some more clothes and hair that we can wear in the customisation avatar thing. Anyways that's all! But really I live this game, especially since I've seen it grow soooo much, it makes me happy!!",appgame like 23 year love although lot suggestion maybe add hospital hopefully clothing store could pleasw finish apps phone would amazing well adding mor character onto phone thing please get clothes hair wear customisation avatar thing anyways thats really live game especially since ive seen grow soooo much make happy,1
This game is very nice for storywriting and the character editing helps u describe ur style . But the only problem is some houses lack a home editor and the stardustcitycinema isn't open yet. Pls update stardust soon . I love ur game so don't make me hate it. Like it so stylised and fun I just like it. But it could need a graphic boost . And mor emotes when u hold an object ar when sitting. And also running should be optional instead of only walking. And when u apply a skincare material it stay,game nice storywriting character editing help u describe ur style problem house lack home editor stardustcitycinema isnt open yet pls update stardust soon love ur game dont make hate like stylised fun like could need graphic boost mor emotes u hold object ar sitting also running optional instead walking u apply skincare material stay,1
"Imma just do 4 stars, It's a 5 but because of whenever I'm updating the app, It just like takes very long, It just drives me mad bruh, Look the game is perfect and stuff but it's just The updating problem, It takes forever, I've been waiting here for like atleast 30 minutes and I'm literally struggling rn, I mean my internet connection speed is perfect, please fix cuz I might uninstall.",imma 4 star 5 whenever im updating app like take long drive mad bruh look game perfect stuff updating problem take forever ive waiting like atleast 30 minute im literally struggling rn mean internet connection speed perfect please fix cuz might uninstall,1
"Its so cool! The producers should make more packs ""free"" it's a waste of money, but over all the updates are super cool! I should have known about this game sooner ( Avatar maker is totally cool! but had to delete it bc it's not free for even ten minutes a day!!) ad free!! so to those who are reading this, you should download this app bc it's fun! And best of all, there is a Stardust city! Updates every week are the best!! And there are even gifts and a new pet maker! Awesome!! Have a good day!!",cool producer make pack free waste money update super cool known game sooner avatar maker totally cool delete bc free even ten minute day ad free reading download app bc fun best stardust city update every week best even gift new pet maker awesome good day,1
"It is one of my favourite games I love it so much but It has a few problems first things first for the cutest packs we have to pay and its not fair so please make a update which you can get a free pack whenever you complete a task and please add more bubble glam furniture bc it,s soo unique it self but people need free creativity and also every year the Halloween, Christmas packs are the same the free ones and thank you puzzu for making great things!♡♡♡",one favourite game love much problem first thing first cutest pack pay fair please make update get free pack whenever complete task please add bubble glam furniture bc soo unique self people need free creativity also every year halloween christmas pack free one thank puzzu making great thing,1
HI PAZU i'm again writing a review because iv'e been thinking of some things that could be added if possible so the Avatar Maker app thing i think it would be really nice if that could actually be added to Avatar World because there is so many more of customizing things and if there could be weather like rain and thunder maybe and if there was a like lights out option so like the lights for the buildings are off because ive been wanting to make Avatar World based content so PLEASE IF YOU CAN! :D,hi pazu im writing review ive thinking thing could added possible avatar maker app thing think would really nice could actually added avatar world many customizing thing could weather like rain thunder maybe like light option like light building ive wanting make avatar world based content please,1
"I love this game . However I would like to give you some tips like adding a Big mall where all things can be found like dresses , furnitures , restaurant and in every mall everyday new items will come because in this game, there is a issue that if you buy everything in a shop , no new thing will come again. And then in train station when the people enter train please allowed us to go in the train , this will make more fun . Make sure you read my message, Best regards.",love game however would like give tip like adding big mall thing found like dress furniture restaurant every mall everyday new item come game issue buy everything shop new thing come train station people enter train please allowed u go train make fun make sure read message best regard,1
"I love this game Soo much and whenever I delete this game, I install it again because this game is a drug for me,I always think about it and I am waiting for every update crazily. but there is a problem this game is so good and we need many characters to play this game and make a big family 3 is not enough for us atleast we need 6,7 characters and secondly we need a weather changer update as soon as possible please because we are tired of seeing this dull sun and moon . we need these 2 updates",love game soo much whenever delete game install game drug mei always think waiting every update crazily problem game good need many character play game make big family 3 enough u atleast need 67 character secondly need weather changer update soon possible please tired seeing dull sun moon need 2 update,1
Avatar world thank you for everything I wanted to tell you that when I take two people down the stairs at the same time then when they get down two more people came at the same time can you fix this glitch and I love all the updates from the start all the way to the end and can you make a snow wonderland it would be amazing if you could do that and one more thing could you make another house maker in stardust city. and the pet maker is the best part because I wanted to make my own pets.,avatar world thank everything wanted tell take two people stair time get two people came time fix glitch love update start way end make snow wonderland would amazing could one thing could make another house maker stardust city pet maker best part wanted make pet,1
"Avatar world is very Incredible and joyastic game!♡ But the reason of me giving 4stars is : The packs r so expencive! We can't even buy one And the characters r also less..atleast Y'all should add The NPC'S editing characters like in our pazu's phone those ppl who r our NPCs I rlly wish we all could edit them..(Changing the skin colour,hairs,New clothes etc) + Aw should add more new clothes shops,new hairstyles and New shoes And Plz it's my request Some players can't afford the packs plz fix it",avatar world incredible joyastic game reason giving 4stars pack r expencive cant even buy one character r also lessatleast yall add npc editing character like pazus phone ppl r npc rlly wish could edit themchanging skin colourhairsnew clothes etc aw add new clothes shopsnew hairstyle new shoe plz request player cant afford pack plz fix,1
It's amazing I love it so so much but you just need to complete star dust city and it will be a solid 10 can you please complete or do another update for the new city please 10/10 and make all the stuff for money free and I will give you a better review please. You must do another update and all the things with bundles aren't friendly and also get more places and a car not a taxi but I love it so so much. There is something a wanna this is so deserves a solid 10/10😃 😃 amazing you deserve it,amazing love much need complete star dust city solid 10 please complete another update new city please 1010 make stuff money free give better review please must another update thing bundle arent friendly also get place car taxi love much something wanna deserves solid 1010 amazing deserve,1
