Review,Feature,Emotion
"I personally love the game it's so realistic perfect and if you don't like to play powerful or gun games (hope you understand) like me it is the best game it's very peaceful and I just want to request something like now you also gives month gifts right you gave the January one and now February as well and when there is a festival like ""helloween"" (sorry if the spelling is wrong) ,""Christmas"" , ""valentine"" and more so in March it's Ramadan so can you make a gift for like Ramadan decoration,clothe","Customization Options, Gift System, Seasonal Events, Cultural Sensitivity, Avatar Customization, Home Decoration",Positive
"Honestly I don't think I've ever found a game this fun. It's inclusive, creative and so.ething I'd never be able to get bored of. There's just one itty bitty thing that nags me about this game. It's the shop. You have to buy everything with real money and its just gets a bit on my nerves. But I recommend anyone reading this to download avatar world like right now! Also sometimes I can't download the new updates. But still best game EVERRRRR!","In-Game Purchases, Update Download Mechanism",Positive
I LOVE THIS GAME!ð¤©ð¤©its like the best game ever. Its so fun i only play this game even if there are a lot of games on my device. And also it almost let you put unlimited stuff in a backpack while other games like yasa pets only allows 3. But maybe you can allow to make more characters and allow characters that are not on the phone to teleport somewhere else like outside the class and also let me buy a bed from the store. Sorry if its too much btw BEST GAME EVERð¤©ð¤©ð¤©,"Backpack Capacity, Character Creation, Teleportation Feature, In-Game Purchases",Positive
"This game is the best game ever 5 Stars. You know why? Because it is so good. It's the best game inside the whole world. You can be anything you can do anything. But you just gotta be careful cause. Sometimes there's ADS and ADS. Is the reason why I have this 5 stars cause sometimes. Cause sometimes IIIII don't know, but ADS are just good because I'm ADS.They can sometimes get you unupset.Because the game that you're playing sometimes gets me upset so I like ad","Customization Options, Open-World Exploration, Ad Management",Positive
"I rate this App 4 stars , it is a bueatiful and fun game however every time I want to multiplayer with my sister or my friends all always glitches which Is sooo annoying like I js wanna play ! Avatar world pls fix this . Also I think that avatar world should make more packs for free because now you basically have to pay for everything like its slowly turning into toca boca .Like - PLS DONT DO THIS ARE U FR. Anyways I hope u agree with my review and pls do my ideas .","Multiplayer Mode, In-App Purchases, Glitch Fixing",Positive
It is very very nice and many more to customise ourself I love it and I like this game and I like every houses This is very very nice game is more fun I like it I cannot describe it how I like this game and we get for some like New year allowing Christmas exam decoration items like tax we can enjoy Bal with many more packs they gave his packs we can buy the bags are you should wait to the halloween Christmas and New year Wednesday they give some facts for free I lik and enjoyment in this game,"Customization Options, Game Enjoyment, Seasonal Decoration Items, In-Game Purchases, Free Items, Gameplay Variety, Home Building, Avatar Customization",Positive
So to start off you should definitely check this out because it is amazing you can explore and create and discover and make your own home and get challenges also most exciting of all is you get updates and a new level of an upgrade so check out this game now and never delete it otherwise it would be a huge mistake of your own life and it feels like it is a great thing thats part of my life and you are not forced to do it I'm just saying a great game can be great thing thats part of your life,"Exploration, Customization, Home Building, Challenges, Updates, Upgrades, Gameplay",Positive
"It's so fun it's actually better than Toca Boca, there's so many places and secrets and which is free unlike toca Boca which you need to pay for, you play it offline too! even if your online you still don't get adds which is so amazing not like other games.you can costumize characters and your house you also have so many houses you can also have a plane which is so super duper cool, and there's a vacation beach I love it so much like you get a update every week or month even sometimes every day.","Cost, Offline Capability, Ad-Free, Customization, Multiple Houses, Transportation Options, Vacation Locations, Frequency of Updates",Positive
I play this game multiple times and it's really fun and I like how if you go offline it still works basically an offline game and I love this but some people say it's bad because you can only play by yourself but really you can play with people if you know the code to the world and also I was wondering if you could give us free stuff like the luxurious things can I see guys I love how you guys can put little like a mystery secrets in the game and you have to find yourself it's so fun and stuff â¥,"Offline Capability, Multiplayer Capability, In-game Items, Secrets and Hidden Content",Positive
"This game is amazing and if you could give a way how to get free packs from the game like watching adds or getting coins that are hidden in the game this would be the best game if that would happen and it will get even better if the character maker had more clothes, socks, shoes and hats and also more hair styles and have more actions too like it's just real life and I wish that there will be more stuff like ice skating â¸ï¸ and it will have more color for the House and more floors hopeadd to game","In-Game Purchases, Character Customization, Game Activities, Home Customization",Positive
This is a great game I love this game so much.. But it takes time to download and it takes so long but it is still worth it so much updates like OMG! I always get notifications of should i update avatar world And whats my answer?Duh! YES! I have to update btw Can AW add a Grooming store for pets?? I love avatar world so much!! But Avatar world needs to fix bugs/glitches bc its sometimes annoying but i still play it And also fix that bug that characters/things double to the place where u get them,"Download Time, Update Frequency, In-Game Store, Bug Fixing, Character/Item Rendering",Positive
"I love this game, its super fun kid safe no online players just a fun game for every kid who loves to roleplay! There are bugs and there super annoying like when I leave the game and join back my character is gone sometimes but yeah. I wish they would let us have 5 free slots instead of 3 and you can't take every character wherever u want overall than that amazing game. Thanks for making this game it always brings a kid a smile to there face.","Character Persistence, Bug Fixing, Character Slots, Character Mobility",Positive
"honestly, the game is amazing. I love it. Me and my gf play together all the time, so that's a plus and i remember we played together when co-op first was added and it was so glitchy it's so much smoother now but I hate when you do anything in co-op all the things you did in co-op aren't saved so there's that, I do think store contents should be reseted every week, and that store bought furniture should have better color choices otherwise this game is awesome and totally recommend 2 ppl :3","Co-op Mode, Save Functionality, Store Contents, Customization Options",Positive
"I love this game. in my opinion obviously, there are many reasons why I love it so much, first of all I love how there is actually good stuff in this game unlike others. I also love how you dont have to pay for the stores or worlds, and many times whenever you get a world it acually worth the money. The gifts in this game are worth aswell, the clothes is cute, the game actually gives good houses for free. And these are ALL THE REASON S WHY I LOVE THIS GAME. Some things that I think will improve","In-Game Purchases, Customization Options, Gift System, Virtual Items, Free Content, Monetary Value",Positive
"This is THE best role-playing game I have ever played! It has SO many different places to explore, house maker, avatar creator, free gifts, promo codes, and MUCH more! You can even play with your friends! The pazu team is working so hard to bring out exciting new updates almost every week! It also doesn't require internet connection! I also have a suggestion for the next update: An aesthetic house maker? I could write so much more but I'm running out of room so thanks! keep up the good work! â¤ï¸","Role-Playing Game, Exploration, House Maker, Avatar Creator, Gifts, Promo Codes, Multiplayer, Internet Connectivity, Update Frequency, Aesthetic House Maker",Positive
"Its good but almost every thing that you ever imagined in avatar world you need to pay for it i wish they try a two day everyting free that would invist a little more money to there company bacause more people will play their game,its a greta game you will like it its an offine game,no ads,and you can have more gifts,everytime thats a holiday thwres new challenges for you,and if you want something its a mystery game or you can find secrets in every buliding in the village,the beach,the new city!","Payment Model, Free Trial, Offline Mode, Ad-Free, Gift System, Holiday Challenges, Mystery Game, Secret Finding, Customization 
In-Game Purchases, Game Engagement, Monetization Strategy",Positive
Avatar World is good and all but I don't like the glitches for instance multi-player mode you all should change it because it has disadvantages like editing characters and houses and spawning cars please make multi-player normal like regular avatar world please add editing characters in the catalog and editing house makers like normal and spawning cars and ordering food please listen multi-player isn't that fun without these things. 3 stars for multi-player,"Multi-player Mode, Character Editing, House Editing, Item Spawning, Food Ordering",Positive
"The game is absolutely amazing, I personally love it. Though I do have a few suggestions. So I do know that we have a new update Stardust city which is amazing I know u guys have to develop it but I just want u guys to remember that thier two other places that also need development example avatar Beach it still needs to be updated as well as avatar city aka capital city of avatar world otherwise I absolutely love it. But a request for u guys could u make everything in avatar free please ð .","Game Updates, In-Game Locations (Avatar Beach, Avatar City, Stardust City), In-Game Purchases, Customization Options",Positive
"This game is amazing. It's time consuming, but in a GOOD way! I normally play Toca Boca, (or ToBo, for a faster name) and it's fine. I haven't bought anything in ToBo tho, so there is only ONE house, and for my three ocs? That won't work! (Btdubs, this is gonna be a long speech) But after world? MORE THAN 1. And that's AWESOME!!!! And the fact how the clothes ate and left no crumbs? Slay. Tho, the fingers are questionable...ðð It's a lot of fun to play anytime, so GET THIS GAME. A.S.A.P. Bye!","Number of Houses, Customization Options, Gameplay, User Interface, Realism",Positive
"Avatar World does keep getting better with every update!(and yes they keep arriving!) This game is probably the best game I've ever played !!!! : â¢Cute graphics and character designs.{: â¢Awwsome clothing shops and outfits.<: â¢Plenty of houses to designâââ And hey! âThe new hawaii,stardust city and pet maker updates are just tooooo awesomeâ!!!! But it would be even better if there were a few more avatar slots availableã: â¡ââ¡ But whatsoever, this game 's still the best!â¡ââ¡","Graphics and Character Design, Clothing and Outfits, Home Design, Avatar Customization, Updates and New Content, Avatar Slots",Positive
"I love this offline game! Ever since I was in 2nd grade in 2022 and always bored, I will go get my iPad and literally play Avatar World for hours!!! I love how they always make everything detailed and cute, my favorite place in Avatar World is the Bubble Glam Mansion!!!! And I love all the updates and all the new gifts, when ever I play this game I always go to my desk and play peacefully. If I were the CEO of Avatar World I would love to send AW Merches to YouTubers!! â¥ï¸â¥ï¸","Game Detail, Updates, Customization, Virtual Environment, Merchandise 
Customization, Virtual Environment, Updates, Merchandise",Positive
Dear Avatar world my mobile is full of space because of your stupid game I like it very good game but it takes a lot of space you must clear your data it takes a lot of space you must clear your data you make it and make a last update you could as a little details but don't put the views update then there would be no space in no one mobile no one play your games like nobody please doing go because they don't like it but if you have too much please then no reply game do want to be like dualingo,"Data Storage, Update Frequency, Game Size",Positive
"I Always thought this game was just Copy Of Toca Boca, No More. But Now That I've Tried it, I've gotten addicted, Opinion. It's Even better then The OG(Sorry Toca Users)Toca Boca, The animations, Expressions, Designs, Free gifts everythingâ, I even spent My Money On This Game For More Packs Because It was Fun. I LOVE ASTRONOMY SO THANK YOU SOOO MUCH FOR ADDING THATââ, However Can you add More Color Choices, Outfits, Accesories, Back accesories, Face, Male hair styles And Skin tonesâ:3 Thank Uâð","Customization Options, Animation, Expression, Design, In-Game Gifts, Content Variety, Payment Options, Astronomy Feature, Color Choices, Outfits, Accessories, Back Accessories, Face Customization, Male Hair Styles, Skin Tones",Positive
BEST GAME I HAVE EVER PLAYED IN MY NINE YEARS OF LIFE ITS THE BEST THING EVER.But there's one problem I wish the toddlers could go in the baby bouncers I wish the creators could make that a future update and once I went to the hospital and a fully black glichted person was standing there with the Dino top on and blue jeans shorts with no eyes and the pointy teeth smile mouth thing BUT ITS STILL THE BEST GAME I RATE IT 5 STARS FOR THE WIN,"Avatar Customization, Baby Bouncers, Graphics/Character Rendering, Hospital Location, Rating System",Positive
I loveeeee avatar world soo much I play it every day â¤ï¸ it's honestly the best roleplay game I have ever played ð I support you so much avatar world but I wish many more things were free tbh..I love it so much no matter what or how you have to purchase some stuff but we get many Houses and gifts..I used to love Toca Boca but now I saw this game I don't even remember the one small house in Toca Boca..I love you avatar world ððð©·â¤ï¸.,"Role-Playing, Customization, In-App Purchases, Virtual Items, Housing Options, Gifts",Positive
This game is a 10/10 cuz this game is really fun you don't have to watch ad's to unlock places & without spending money you can still play this game what I'm saying is you don't need money to enjoy this game one time I Glitched and I had to uninstall and download all over again but I don't mind definitely recommended ð¥°ð¥° edit: A LOT OF NEW UPDATES AND A SKINCARE SHOP?!?!? GIRL... THANK YOU SMMMM,"Ad-Free Experience, In-App Purchases, Stability, Updates, Customization Options",Positive
Avatar world is the best game in the world like it is like literally good literally good like I don't know what the world would do without it but the only thing that is wrong with it is the will you take me and pass again the will pass yeah that I'm sorry I'll pass yeah. They need to like open it because like most of the people in like I'm tired really want to know how to open it but like we are not getting it like we press around us but then they said only adults only be putting adults only and,"Access Control (Age Restriction), User Interface (Navigation)",Positive
It is really good I can play it anytime and I can go on vications go to the waterpark there are so many options I love this game I can even go to other places with airplane and the new building in which I can make my different houses it is so amazing cause have so much space to make three different houses and I make those houses in the three different building that has been made it's really good and this also helps make concentrate this is a very peaceful game I love it is realy good.,"Customization Options, Exploration, Virtual Travel, Building and Design, Relaxation and Concentration, Variety of Locations, Air Travel, Multi-Structure Building",Positive
This is actually a great experience there's a lot of free things I'd recommend downloading it it's a pretty fun game and it has a lot of things my little sister also plays it and she's 8 years old and she is obsessed with it and even the shop has free things the best thing is whenever you go update it the update is free not like toca Boca overall I'd recommend downloading it it's a pretty fun game and it's appropriate for kids I had a pretty fun experience with it definitely a 5 stars review,"Free Content, Update Frequency, Age Appropriateness, In-App Purchases, Overall Experience",Positive
"Welcome to Avatar World, the most innovative role-playing game of 2024. Explore and experience a fun and super cute world, full of incredible locations, towns, cities and characters, with endless items and avatars to interact with. (We are soooooooo excited to create this special game for you, the players! thank you for choosing us, and we look forward to communicate with you and build the things that you want!) Customize avatars and build your dream home in a bustling city. With an amazing opt","Customization, Exploration, Character Interaction, Home Building, Quests, Storylines, Discovery, Skill Development, Gameplay, User Interface, Immersion, Educational Value, Avatar Creation, World Exploration, Social Interaction, Problem-Solving, Creativity Development",Positive
"July 23, 2023, I played this game, not sure what will be look like in future, but ive got curious about the game, explored secrets, made houses by myself, normal roleplaying things got into my mind but i never actually posted one of them ~ Ive got addicted to the game by 2024, only due to updates & house maker updates December 2024 Deleted the game due to device storage data JanuaryâFebuary 2025 I reinstalled the game,only due to the very new update:: stardust city update âââââ","Roleplaying, House Maker, Updates, Storage, Device Data, Stardust City Update",Positive
I love Avatar world is like the best Because it's like the best game you can ever ask for it has like cool restaurants in like really realistic things that you'll see in the real world and it's like just so awesome and you get new updates every single day and you can also celebrate Christmas Halloween and there's like secret codes everywhere like in the airport or the ice cream shop it's just so fun I highly recommend people playing this game and it's so well for little kids,"Realistic Environments, Regular Updates, Celebrations and Events, Secret Codes, Kid-Friendliness, Restaurants, Real-World Simulations",Positive
"I am so happy because there is free every thing . When my exam are over I play this game . I like every things that has puzzels and u can do any thing in this game . I like bake ground sound of this game . In this we can make humans , animals and animals . We can imaginate other game , real life things and cartoon too! like poppy play time , tom and Jerry , about world and every thing etc . In 2022 i see postes of this game . i like and love this and i down load this game . Every day i play .","Customization, Puzzle, Sound Effects, Imaginative Gameplay, Quests, Character Creation, Open-World Exploration",Positive
Hey pazu I am a big fan of your games and I also gives you 5 star so I came here to tell that please can you please make the new bubble homes garden free please just please unlock it no need of the plants and other things only the garden please please please and also your game is worthy to 5star I really appreciate it It's better this game is real role play game and I am a person who really love to make my own story so this game is the one I wonder why didn't I found this game before ð¥°ð¥°,"In-Game Purchases, Game Content, Customization Options, Role-Playing Gameplay",Positive
I absolutely love avatar world!!! It is my favourite game. You don't even need WiFi. It has no ads which is great ð. You can make up to three characters for free but if you want more you can pay a cheap price of Â£2.99. Loads of free houses to design and I really recommend. I love playing with my friends on multiplayer mode and we enjoy going to he waterpark and bringing our kids there. Graphics are lovely and is hard to get bored. One thing I would like them to include is a soft play area. Byee,"Offline Capability, Ad-Free, Character Customization, In-App Purchases, Home Design, Multiplayer Mode, Graphics Quality, Content Variety, User Suggestions",Positive
I love Avatar world and it's like one of my favorite games games I play a lot there is a lot of free things and a variety of places to go and I wish in the future they get more houses I just wish that like there was a little bit more like things to make people like cuz right now it's only three and I wish they added at least two more people that you could like design or whatever but avatar world is a really fun game and I really liked it a lot and that's what I think about Avatar world,"Variety of Places, Customization Options, Availability of Free Items, Number of Designable Characters, Housing Options",Positive
"It's super kid friendly and entertaining! My kid loves to play this game everyday. The best part is that it's an offline game and you get to create new characters from babies to grannies! Love it just 1 problem though, could make the wedding packages and what not free. But overall really nice game and is definitely better than toca boca! Hoefully you do make atleast 2 packages free before the next update pls! Although it could include more buildings like the polic station and jails as well!!!","Offline Capability, Character Customization, In-App Purchases, Building Variety, Content Updates",Positive
It's the best I love it I play this for hours it's so good I love it my brother's and sisters love it it's the best game for kids and adults sometimes I'm glad whoever made this made it it has no ads or anything and it's a choice if you want to buy stuff but it would always be my number one game to play every day I wake up and just play this game and it's just so great 5 stars always one thing they can approve is maybe update it more often and maybe build stuff a bit faster but I know it's hard,"Ad-Free Experience, In-App Purchases, Update Frequency, Building Speed, Overall Gameplay, Customization Options, Multiplayer Capability, Educational Value, User Interface, Content Variety",Positive
"Avatar World is a fantastic app that offers endless opportunities for creativity and self-expression. It provides a wide range of customization options, from hairstyles and outfits to unique accessories, allowing users to design avatars that truly reflect their style. The graphics are vibrant and well-crafted, enhancing the overall experience. The app's intuitive interface makes it easy to navigate, ensuring a smooth and enjoyable experience for users of all ages","Customization Options, Graphics, Intuitive Interface",Positive
"Awesome game, all the necessary things are free unlike most avatar story games like this, no ads and we get gifts, the game is lovely, and i have a recommendation, for pets add leashes, and also pets have walking animations also with the leash make sure it tps with your character, also with all the reviews saying its a rip off from toca boca its not, infact its better srry toca boca, also people saying there needs to be more free things, they are greedy rats we get alot of free stuff be grateful","In-Game Purchases, Advertisements, Pets, Animations, Character Customization, Gameplay, Content Quantity 
Leash Feature, Walking Animations, Third-Person Perspective, Character Movement 
Originality, Content Quantity, Gratitude 
Customization Options, Avatar Creation, Home Building, Quests, Storylines, Character Interactions, Life Skills, Educational Value, Gameplay, User Interface",Positive
it's so adorable you did very hard on the game you can make your very own character and most things are free it steal gets 5 stars the music room at the school is the best in the world music's my favourite thing this game is amazing I play with my sister and she loves it but I wish that the progress you made while your in other peoples world stayed cause I really like the progress. Don't get me started on the newest update the house is amazing I love stardust city and the movies love your game!,"Character Customization, Music Feature, Multiplayer, Progress Tracking, Game Updates, Virtual Home Building, City Exploration, Movie Feature",Positive
