Review,Feature
"Trying to get away from cloud-based automation, I installed home assistant on my Synology server, as well as the integration local Tuya. Everything is functioning perfectly. So, I downloaded this app, to control using my phone. The app works well, and it's nicely laid out. However, one star off because widgets are a problem. In essence, when I tap a widget, it does what I want it to do, but then it is replaced by an endlessly spinning arrow. Fix: I have to delete the widget.",Review -> Widget Functionality
"App is great and would have been 5 stars, but the recent update that added Android 11 power menu buttons changed how location is reported. It would always regularly turn on the GPS to get a position, but it was always very brief. Just a flash. Now it keeps GPS on for a minute or longer every time I unlock my phone. It seems to be tied to power menu controls. If I remove all Home Assistant controls it reverts the old behavior. I was using only lights and scenes as power menu tiles.","Review -> Location Reporting, Power Menu Controls, GPS Functionality, Automation"
"Dark theme sucks. The app is great overall, but the app is suck always in dark theme which makes the text on my picture cards white, to contrast with the normally black background, but the picture is white, so you can't see the text at all. Very frustrating. Using my browser to view the same content looks fine. Why can't the phone app look like the web app?","Review -> User Interface, Theme Customization, Display Settings, Compatibility with Web App"
"While the app by itself works fine, the latest update is a bit ""temperamental"". I notice that it looses connection a lot, even when I'm on the same network as my Home Assistant is, and suddenly the Battery and WiFi sensors disappeared. I hope truly that this can be fixed, because I think it is a great addition to Home Assistant. Specifically the fact, that it updates location. Please keep up the good work! And I hope that more sensors will be added. In Hass Logs: [homeassistant.components.mobile_app.webhook] Refusing to update non-registered sensor","Review -> Connection Stability, Sensor Availability, Location Updates, Sensor Variety"
"Awesome App, but pleeeease assign the ""Location is disabled"" notification to another channel so I can disable that one specifically. I only use the wifi sensors on my phone and they work fine without location but I keep getting the notification everytime I open the app which is really annoying and I don't want to disable the notifications as a whole","Review -> Notification Management, Location Services, Sensor Integration"
The main server app is great but this phone app is not. Been requesting support for multiple servers/homes for years and am baffled why it is still missing. Adding a second server will delete the first. You cannot have more than one home through the app.,"Review -> Multi-Server Support, Multi-Home Support"
"Need improvements to widgets, For example you can provide an option to auto update home screen widgets data every 5mins or else depending on user selection, And can also provide option to hide widgets if no wifi is available, And it will be appreciated if u bring support of solarman inverter also, Thank you. 👍","Review -> Auto Update, Widget Customization, WiFi Connectivity, Inverter Support"
"I used to be able to tap and drag along a statistic graph to quickly see changes over time but in a recent update that functionality has gone, disappointed.","I used to be able to tap and drag along a statistic graph to quickly see changes over time but in a recent update that functionality has gone, disappointed. -> Interactive Graphs, Trend Analysis"
Update: needed to use hairpin instead of local DNS. Recent update seems to have broken local / remote network traversal. Gets stuck reconnecting when switching between local or remote or vice versa. Doesn't occur when using a chrome browser session.,"Review -> Network Connectivity, Remote Access"
Something changed around November 2023. App performance is terrible. The interface is now so slow that it takes seconds to even scroll down a page. UPDATE NOV 2024: Something changed and now the custom screen I spent a lot of effort on is a disaster. These breaking changes are a problem. Please get it together. I'm paying you monthly for this.,"Review -> App Performance, Interface Responsiveness, Customization Features"
"I love home assistant but recently I've been getting an android message that says: ""Home assistant isn't Responding"" about 10 times a day regardless of what I'm doing on my phone. The worst part is that it appears over other apps and disrupts the use of my phone. I'm not sure what's changed to suddenly be giving me this issue. I've tried rebooting the phone and reinstalling the app. Nothing helps.","Review -> Stability and Reliability, Notification System, App Performance"
"The app is great! But i noticed that when you look at a camera stream through the app and you return to the home screen, the stream goes on and it keeps consuming a lot of data. Fortunately I noticed this really quickly but still lost around 300mb in a few minutes. My phone allows to me to monitor the background data usage. I double checked if this was the case. 4/5, fix this quickly to get 5/5.","Review -> Background Data Usage, Camera Stream Feature"
"App on the phone is flawless and works really well. Saw Android Auto had some love, however in it's current state it is near useless as it just lists everything. It's a bit like with the base screen when you first log into HA, shows everything. Except on AA it is a nightmare to navigate through. Is there a way to curate the screen to have the info that is important from the car?","Review -> Android Auto Functionality, User Interface, Customization Options"
beware mobile app users: downloaded backup.bin files are not usable for restore. must use web UI to get .tar file.,"Beware mobile app users: downloaded backup.bin files are not usable for restore. must use web UI to get .tar file. -> Backup and Restore, User Interface"
"Amazing other than one glaring issue; The location update takes too long. I have made sure it has no battery optimisation, and anything else I can do in the app settings. I moved to this app to get rid of own tracks however it seems I need to reinstall owntracks unless I'm doing something wrong. (One plus 7 pro, homeassistant 0.103.5, app v 1.3.1)","Review -> Location Update, Battery Optimization"
"It works perfectly 95% of the time, but every now and then it will decide it can't connect to either the internal or external URL. Sometimes I can force close to fix it and sometimes not. I'm always able to access from my laptop connected to the same IP though, which leads me to it being a problem with the app.","Review -> Connectivity, App Stability"
"Can we make the back button, go back? Not close the app every time I want to dismiss a pop-up card. Instead of just pushing back, I have to reach to the top left corner of my giant phone to press X.","Review -> Navigation, User Interface, Pop-up Card Dismissal"
"I am on Android 11 and my wife is on Android 12. On my phone the following day, the app can't find the server. Nor can I reach it from the chrome browser on my phone so I don't know if this is an Android 11 issue or the Home assistant server. In either case I have to clear data/cache, remove, reboot and reinstall so not viable in the long term. I was a bit surprised my battery status and charge remaining was exposed, don't remember giving permission for that at install time.","Review -> Connectivity, Server Accessibility, Data Privacy, Permission Management, App Stability"
"rarely works without manually checking and updating. as with many opensource projects, there are lags in updates. Also quite hostile discussion groups. Better to look for a commercially available framwork.","Review -> Update Frequency, Community Support, Automation Reliability"
"Good app, but won't stop hammering my sensors no matter what I have set. Frequency is every 15 min and persistent connection turned off. I only have the default sensors + location. But every time I open the app, I get a sensor update notification multiple times per min until I close the app. It's worst when I'm looking at the sensor list. The hit on battery gets so bad if left in the background.","Review -> Sensor Update Frequency, Persistent Connection, Battery Life, Notification System"
"Works great except for one thing. If you make a convenient widget for toggling a light for example, once you leave your home network the button will spin and become unusable forever, even if you return to your network. Having to open the app to toggle lights makes the whole setup not worth it sadly.","Review -> Remote Access, Widget Functionality, Network Connectivity"
"Device tracking based on the wifi network does not work on a Google Pixel 7. Only works based on a GPS, but completely useless as it retains last seen gps location even the phone is not on the location anymore, and not on the local wifi. It shows home no matter what. Phone obviously need to be online and the gps on to send the current location. All other brands of phones and tablets I have work fine based on the home wifi.","Review -> Device Tracking, Location Services, Wifi Connectivity, GPS Services"
"Its indistinguishable from the view you get when you use ""add to homepage"" from chrome on android, apart from one sidebar menu item that says app configuration that currently just shows version info. Actually found another difference, swiping down from top of screen does not refresh the view like it does with chrome. I guess this is a start to add more functionality.","Review -> User Interface, Refresh Functionality, App Configuration"
"I moved my HA server out of the wireless network segment. (In fact I virtualised it into a DMZ . I removed the android cache and storage , uninstalled , rebooted and re-installed the app. Still trys to hit the old server URL!! - doesn't forget it - then throws a hissy fit because it can't find the server and forces me to resubmit the new URL EVERY DAMNED RESTART . Such a pain !","Review -> Server URL Configuration, Data Persistence, App Restart Behavior"
"Please fix the issue when reconnecting with Authentik, first login is fine, but after it expires, any attempt to connect after that seems to cause a loop where it keeps sending the link to my browser, I have a pixel 6 pro and it send it so quickly that it lags my phone a bit until I can force stop the app, also a mini dos attack against my server, only choice is to clear everything with app, so I can login like it was the first time again, and setup all permissions again (which is also a pain).","Review -> Authentication, Authorization, Reconnection, Performance, Security, User Experience"
"I am trying to change/set the area of some devices through de app, from outside of my house. And the app seems not to change (it is not updating the field). I could find and workaround. Type the whole name, and then click the item. And it works to keep it selected and then, Update the device.","Review -> Device Control, Remote Access, User Interface"
"I really like that this app so as full featured as the web browser view. What I don't like, app suddenly not working the next day for no real reason on both phone & tablet The fix for me, clear cache, then data. Uninstall. Reinstall and set up again = app now working 🤷‍♀️ Update,app stopped working. Did the same process as before, didn't work. Please fix!! Update 13/10 same issues. Please fix the app","Review -> App Stability, Cache Management, Data Management, Installation/Reinstallation Process"
"Working reasonably well and now we have easy actionable notifications, which is great. The last update appears to have changed the way the widgets look and not for the better. The smaller round buttons looked good, but now they are large white rectangles that are not as nice to see on the home screen.","Review -> User Interface, Widget Customization, Notification System"
"I tried multiple times to get this app to work but no matter what all it says is ""unable to connect to home assistant"" and the only option available is retry. I can access it just fine on my computer (where I can see ""log in attempt failed"" notifications with my phone's IP address) so I know everything is working from that end. I've uninstalled and reinstalled the app and it still won't work.","Review -> Connectivity, Login/Authentication"
"Crashes constantly. Had to completely clear cache and data for it to stop crashing which effectively disables it because it is no longer logged in to my account. Opening the app and logging in again starts the cycle of endless crashes once more. Disappointing because for the first day of using it it seemed quite neat. From then on, unusable. UPDATE: the app has been stable for me for a while now so upgrading the score! UPDATE2: Still crashes and burns through battery when away from home","Review -> Stability, Battery Life, Login/Authentication"
"There is super anoyying bug that didn't let me access my server because this app can't resolve the domain name, why? I can access my server with normal browser so atm i will just use android browser than this app since it so much realible than this!","Review -> Domain Name Resolution, Connectivity, Reliability"
"I really want this to be better, but it isn't. It's pretty okay on the web interface, but that's not what we're waiting here. We're rating the app version and it sucks. It's constantly having connection issues and it's not my router or Internet. A few days after and update it stops working and refuses to work until the next update until a few days later.. well you get the picture. It's like the instance is blocking just my phone inconsistently.","Review -> Connection Stability, App Performance"
Fantastic works well controlling everything from a raspi 4B+. Only issues and this could be my fault but I'm finding I cannot edit anything with the app. Just control items only. Would be great if I could edit things like I do with the web interface. Apart from that zero issues.,"Review -> Edit Functionality, Control Functionality"
"Would be nice to just set homeassistant.local:8123 as IP adress to avoid issues with dynamic IPs. It works fine in the browser, so it would be really cool to have it in the app as well. Other than that it's a nice app for Homeassistent for getting notifications and having quick access to the platform.","Review -> IP Address Configuration, Accessibility via App"
"Unable to connect to server. Traefik reverse proxy, letsencrypt certs, web works, app doesn't work. Force stop && clear cache doesn't help.","Unable to connect to server. Traefik reverse proxy, letsencrypt certs, web works, app doesn't work. Force stop && clear cache doesn't help. -> Connect Anywhere, Home Assistant Cloud"
"Works great on the local network. After an easy setup. However I can't access it remotely. Where I can add my duckdns address? Or even change my local one? Also, if you could make it so rotating the phone from portrait to landscape doesn't refresh, that would be freakin awesome!","Review -> Remote Access, Display Orientation, Custom Domain Configuration"
"The only issue, when changing colors in scene editing, it is a little flaky. It jumps all over the place. It is better using a computer to edit scenes. Outside of that, love the app!","Review -> Scene Editing, Color Changing, Mobile App Usability"
App works great until you try to setup remote access with duck dns and let's encrypt... I can login from the browser on my phone but not with the app using domain or IP address the app doesn't seem to have a way to handle self signed certificates like on chrome when it warns you that the certificate is self signed and gives you the option to proceed any way 5 stars if fixed!!! Thanks,"Review -> Remote Access, Certificate Handling, Compatibility with Duck DNS and Let's Encrypt"
"Please fix the problem reported by another reviewer. After deleting authentication token, the app says ""unable to connect to home assistant"" and HA log has ""Login attempt or request with invalid authentication from 192.168.1.150"" entry which is the IP of the android device. The retry button does not do anything. UPDATE: To fix the problem above, do NOT reinstall the app. it does not help. Instead, keep the app installed and delete it's data and cache (android settings). This will effectively reset the app.","Review -> Authentication, Connectivity, Data Management, Cache Management, User Interface"
"Great app but please improve gps features with more settings, like update by time frequency or distance and accuracy. A lot of times when app is in background the position is updated after half hour or isn't updated! App ignore battery optimization but on my Huawei P20 when app is in background position didn't never update. To avoid this I suggest a persistent notification.","Review -> GPS Features, Background App Refresh, Battery Optimization, Notification Settings, Location Updates, Update Frequency, Accuracy Settings"
"Great option to replace the chrome browser version, however it's quicker to force kill the app and restart than to wait for it to 'reconnect' when it has been in the background. I also get semi regular notifications from Android that the app is taking a lot of battery power.","Review -> Background App Refresh, Battery Efficiency, Reconnection Feature"
"Great app, but a recent change broke the theming and now the app is always in a half dark mode making a lot of the screen content hard to read. I wish there was a way to force dark mode on or off - Home Assistant is light, so having it look dark on the app is weird and not optimized.","Review -> Theming, Dark Mode, Display/Screen Content Readability"
"Good app so far but seems to have a memory issue of some sort on my tablet, having it up for a long period makes it unusable and have to force close and restart app. Using it once in a while is fine but was hoping to leave the app open all the time.","Review -> Performance, Stability"
"First release without any bugs. But i feel bit difficult to scroll at custom components. Except this, everything feels smooth. Edit: (Feb 2020) app opens fast, but after using/creating automation editor, the screen getting very very slow and unable to save the automation with save floating button as it's not detecting. Edit: (Mar 20) everything works, except when I'm in local network (specefic router SSID), it's not connecting local IP address. It's still trying to connect public address.","Review -> Performance, Custom Component Usability, Automation Editor, Connectivity, Save Functionality, Local Network Connectivity"
"If I get the app runing and log in, it may work but you need to force kill it or uninstall every second startup. Once in the app the GPS detection is totally off, rendering any location automation useless. Off I men by several hundred meters in next neighborhood even when detected home wifi. Other GPS apps work fine from fitness trackers to mapps. This persists for months while being worked on features you can't use... sadly","Review -> App Stability, GPS Detection, Location Automation, Wifi Detection"
"A consistent issue is having is the application will not connect right away. I have to retry 10-15 times in a row until it finally connects. The, I also use the bit for my Google watch but have to start the application on my phone first before I can use my watch. So to open my garage door (most of the time) is to open my phone app and wait for it to connect and I can use the button on my watch. Worthless.","Review -> Connectivity, Wear OS Compatibility, Mobile App Performance"
"EDIT: New record, 5.0h runtime in the background, resulted in 3160mah used by it. Is a while (true) loop running in the background? How is this possible? OLD: The recent updates basically made my device unusable. This app sucks 37% off my battery while it's just running in the background, even the screen uses way less... Otherwise it's a great app. Edit: It's now worse, with using 47% of my battery while running the background. 1786mah of a full day. My rating is now lower ...","Review -> Battery Life, Background Process Management"
"App keep crashing after March update. U installed and installed, same issue. Is there a way to rollback to previous version? One prompt came out, saying updated Android Webview is causing HA app to crash. Rolled back Android Webview to previous version, still the same. Please help.","App keep crashing after March update -> Stability, Update Management 
Updated Android Webview is causing HA app to crash -> Compatibility, Third-Party Integration"
Since the last update I cannot connect to my Home Assistant server. The error message states that the Mobile App integration is not configured on my server. Manually added the Mobile App integration to the configuration.yaml file but it did not fix the issue. Please advise.,"Review -> Mobile App Integration, Configuration"
"I've set this app on my phone to update every minute when charging. So why did home assistant not get any updates for more than 20 minutes? If I hadn't taken the phone off the charger when it hit 90%, it would have charged beyond 90% (which I don't want) because the relevant automations just didn't trigger due to the lack of up-to-date info to act on :-(","Review -> Automation, Data Updates, Charging Status, Notification"
"Please give me an option to update my gps more frequently! Almost perfect other then too slow to update GPS position. Just need a couple minutes faster. I know it'll use more battery, but just give me a warning when I select it that it's my own risk.","Review -> GPS Update Frequency, Battery Life"
"Never works. Only connects maybe 20% of the time. I have to kill the app, edit my settings, remove the local address, save, activate, edit again, add local address back, save, activate, then maybe, just maybe will it connect. I have a Nabu Casa account and for awhile I just settled on letting the app connect via the cloud regardless of whether or not I was on my local network... well that doesn't work anymore too.","Review -> Connectivity, Cloud Connectivity, Local Network Connectivity, App Stability"
"Version 2023.10.2 is incredibly slow to load, requiring tens of seconds to load a complete dashboard, entity historical data, or lists of items (automations, entities, integrations). Numerous times I've seen the ""trouble loading"" dialog pop up when opening the app. Making matters worse is that this data doesn't seem to be cached very long, so the long loading is required each time I pick up my phone to check something or toggle an entity. Didn't have this problem with the previous app version","Review -> Loading Speed, Data Caching, Dashboard Loading, Entity Historical Data Loading, List Loading (Automations, Entities, Integrations)"
Connection keeps dropping out over wifi / mobile app. Never had an issue with the PC accessing home assistant in the web browser. Have also had issues with home assistant blocking the mobile app entirely at times. Seems like it really needs an update.,"Connection keeps dropping out over wifi / mobile app. Never had an issue with the PC accessing home assistant in the web browser. Have also had issues with home assistant blocking the mobile app entirely at times. Seems like it really needs an update.
-> Connectivity, Mobile App Compatibility, Update Mechanism"
"I love the app but... Please stop checking the url. I use the app on different locations and always cleared the url so that the app can automatically find the home-assistant server. When I now clear the url, the app tells me that the ""url can not be parsed"" ... Please help. I don't know the ip address (and have no way to check via my smartphone), and can not clear the ""faulty"" address (from different location) currently programed in the app...","Review -> Automatic Server Discovery, URL Configuration, Error Handling"
"Unfortunately theme in the HA and this app changed and now if you have date time object (possibly others as well), it's name can not be longer than 13 characters, otherwise it will be truncated. The datetime box is huge and takes the rest of the space although being mostly empty. I have reported this bug on the GitHub more than 6 months ago and nothing happened. After me urging it after months I got response that they ""might adjust the theme"". I have to lower the rating.","Review -> User Interface, Data Representation, Theme Customization"
latest version no longer knows when it is on the local network to change status even when opening the app while on the local network it stil thinks it is not home and it only gets worse now it doesn't know when I am not on local network it doesn't update it location at all one of it's features that I liked no longer functions,"Review -> Location Awareness, Automation, Remote Access"
"I cant even get past the first screen on this app. Just says ""Select your home assistant server"" and i see a progress bar thats just spinning in an infinite loop. I only gave this a 2 because im pretty sure it works better than my current app, i just cant get past this loading screen.","Review -> Server Connection, Loading Screen, Initial Setup"
"kinda useful, but the app is hidiously laggy (to the point I keep switching switches off because I think they didn't react). Also widgets feel like an afterthought that doesn't work well and the battery consumption is ridiculous (drains as much as google maps navigating even without any sensors enabled)","Review -> Performance, Widget Functionality, Battery Life"
