Review,Feature
"Still not working when not connected through internal LAN. All stuff configured correctly (nginx, certificate, port redirection). It works flawlessly in browser, therefore it's obviously a problem of the app.","Review -> Remote Access, Connectivity"
"The latest update is using a lot more battery in background than before. My pixel 6 pro now shows 25% of battery goes to HA, even though screen time is only a few minutes. With exactly the same settings a month ago there was no such problem.","Review -> Battery Life, Background Process Management"
"Tried this a while ago and was a dud. Much better now and I have it on two newer phones. However, I dusted off a Samsung A20, with Android 9. The A20 does not have the 5G connection to my router, so good job it has the older G watzit! EXCEPT the app, when running on an A20, with Android 9, and less than 5G, cannot connect to the server. So, if you've older phones (and the A20 ain't that old), and you expect to use them around the house as mounted HA consoles, and they don't run on 5G, don't bother.","Review -> Connectivity, Compatibility"
"Great app but freezing on Android. Every time I launch de app, it freezes. I need to stop it and restart it several time until I get lucky. I like the app though, and the capability to connect easily o mobile to my Raspberry 4 with Hassio running.","Review -> Stability and Performance, Connectivity to Raspberry Pi with Hassio"
Cannot access the external url Not able to configure the app with external url. U installed and re installed several times. Would be good if it can be accessed outside your own network Update: had to clear the cache of the app locally and can now configure it.,"Review -> External Access, Cache Management, Configuration"
"For some reason, after formatting my device, it always fail to log in for supposed incorrect username or password. I use a password manager to store and it logs in correctly in my local web (home assistant os, rp2b) with the same user.","Review -> Login/Authentication, Password Management"
"I wish I could open the app settings without deleting all app data. I wish I could get it to retry to connect to my home assistant instance, instead of caching an nginx default page.","Review -> App Settings, Connection Retry, Cache Management"
Great app to access HA. Would like it to use HA server time zone when travelling so that logbook and history events do not use local time zone you are currently in. Changing time zone on the app device helps to get correct times displayed but why do you have to this??,"Review -> Time Zone Handling, Logbook, History Events, Device Time Zone Synchronization"
Like it. Just a small change that would be good. Give the option to refresh your custom panel. I'm creating one in react and I need to uninstall and reinstall the app to get the new updates I make. It must pull in the js when installing the app. Can we refresh the cached js in the app config tab,"Review -> Custom Panel Refresh, App Update Mechanism, Cache Management"
"Works as intended. Currently doesn't allow me to use the mic (needed for Almond), and I can't seem to be able to enable mic permission on the app from the phone settings.","Review -> Microphone Permission, App Permission Settings"
"Stuck in dark mode which makes much of the interface harder to read. I found the setting to choose modes, but it doesn't change the background at all.","Review -> User Interface, Theme/Display Mode"
Finally it's here. Basic functions are same as web UI but notification switch is grayed out. I can receive chrome notification on web GUI though. please fix the notification in next release!,"Review -> Notification Feature, Mobile App Functionality"
Works ok but you cannot change the appearance of dashboards for the visually impaired or elderly or even for fun so without some proper design features it's use is extremely limited.,"Review -> Customization Options, Accessibility Features, User Interface Design"
"Was my favorite app on my phone until 2 days ago. I don't always want my location on, and the app is now prompting me to turn it on before a can access the rest. Otherwise, I love this app, and everything HA. Please get rid of the location prompt","Review -> Location Services, Accessibility/Permission Settings"
"Pretty awesome app, behaves well for how it renders. Only gotcha is you cant have multiple HA instances connected to the app (example: one at a friend's house and another at your house)","Review -> Multi-Instance Connection, Scalability"
"Open the app and I get a blank white page that says, ""select the instance you would like to connect to"", then that's it. What the hell does that mean and why isn't there anything to choose from. There is nothing to click on, no icons, nothing, no settings, nothing. Completely useless.","Review -> Instance Selection, User Interface, Connectivity Options"
"When using the app with a local IP address and trying to access media, I get SSL errors. On the forums the HA team said the app requires SSL and they will not change this. This is a load of rubbish, no SSL should be fine for local connections, hence my rating. Also there is no way to clear the logbook and many have complained of this online. Avoid.","Review -> SSL Support, Logbook Management, Local Connection Support"
Home Assistant Internal Connection URL doesn't seems to work. It always tries to use Home Assistant URL which is by default and mainly used as external URL. Please fix Internal URL. I'm using this app on OnePlus5,"Review -> Internal Connection URL, Home Assistant URL"
"Doesn't detect all my devices. Help text is hopeless, dives right into editing config files and sending commands but doesn't explain where or how. Written by people who already understand it for the same audience. Useless.","Review -> Device Detection, Documentation/Help Resources"
After the latest update the HA mobile app location/zone reporting is received by HUGE delays (30 mins or more). It renders all location based automatisation useless. I wish for less added feutures but flawless functionality as in the past...t,"Review -> Location Reporting, Automation Functionality, Mobile App Performance"
"Huh? That's what I said when I first installed the Android app and took a look at the mess of it's onboarding and design 🤢 and later, when I took a second crack at trying the app and went to its web page — ""Huh?"" Was again all I could say in the face of that, comically confusing jigsaw puzzle of an app! 🤮 Yikes","Review -> Onboarding Process, User Interface Design"
Nasty problem: if you use a large font you get stuck in the dialog about permission to access location data. You can't scroll down to 'finish'.,"Review: if you use a large font you get stuck in the dialog about permission to access location data. You can't scroll down to 'finish'. 
-> Font Size, Location Services, User Interface"
Works great but it requires gps to determine if you are on a specific wifi network for using internal url i stead of external. I am not a fan of having gps on always.,"Review -> Location Services, Wifi Connectivity, Internal URL Access"
"Since the new update, it loads the data faster when opening the app. I will leave 5 stars once the devs figure it out to cache things, so there is no need to look at the loading data screen. If this native app can't use caching to improve startup etc compared to a browser.... then what's the purpose of the native app? Just make a PWA instead","Review -> Data Loading Speed, Caching Capability, Startup Performance"
"The app refuses to accept my tls certificate, with no option to override the decision. What a ridiculous behavior by an app that is made to connect to people's private servers. A warning would have been fine but refusing to work... Fail.","Review -> TLS Certificate Validation, Error Handling and Override Options"
"Horrible app since the first screen asks: ""Select the instance you would like to Connect to:"" What does that mean. There should be instructions to let me know what I'm suppose to do next. As for all the youtube video are already on button menus, there's no instructions on what I'm suppose to do next...","Review -> User Guidance, Onboarding Process, Instructional Content"
"The app worked on my old phone, but on my new phone, it won't save my URL. Upon first launch, it prompted me for the URL, so I entered it. The next day, I opened the app and it prompted me to select my instance, but there were no options. I'm stuck using a browser for now.","Review -> URL Saving, Instance Selection"
Trying to copy/paste into the username field crashes the app. Other than that it works well. Looks like the issue is already reported to gitlab (home-assistant-android issue 103),"Review -> Username Field, Copy/Paste Functionality, App Stability"
"Does not support proper webview so can't be accessed behind a Google OAuth proxy outside of the home network. Works well at home, but if you want to use any mobile related triggers away from home, you'll have to harden your server another way","Review -> Remote Access, Security Features"
"Really needs to provide the actual http error when unable to connect remotely. ""Unable to Connect"" is not useful.","Review -> Error Messaging, Remote Connectivity"
"After 2023.9 core update loading of custom components is a huge problem. Probably changed way of handling with cache, as purging doesn't help. Can't load Dwains Dashboard on Android.","Review -> Custom Component Loading, Cache Handling, Compatibility with Android"
"Recent update broke my theme as well, making what looks like the background and some text very dark. Backend selected themes also doesn't make a difference to styling","Recent update broke my theme as well, making what looks like the background and some text very dark. Backend selected themes also doesn't make a difference to styling -> User Interface, Theme Customization"
"Can't turn off certificate checking. Every application imaginable let's you turn off certificate validation, but not this one.","Can't turn off certificate checking. Every application imaginable let's you turn off certificate validation, but not this one. -> Certificate Validation, Security Features"
"Use on 2 phones. The first is great, the second one every 3 or 4 days refuses to update my location so my out of home routine is broken. Like today, after 8 hours I've discovered that I never left my home","Review -> Location Tracking, Automation"
Can't use an IP address in the URL. Only accepts a fully qualified hostname. Not very useful when setting up a test configuration on my home network.,"Review -> URL Configuration, Network Compatibility"
i can't login as the login page are half hidden on the top and I'm not able to click on username to write my username. Only the space of password are visible.,"Review -> Login Functionality, User Interface, Responsiveness"
Keep trying to setup but it can't get past the startup page. Some instructions on what to do would be great.,Review -> Startup/Installation Process
"needs a way to ignore ssl cert errors when on LAN, and a look at the location tracker. otherwise, very nice Hass experience!","Review -> SSL Certificate Error Handling, Location Tracking"
Not even finding a server. Tried manual local Web address and IP address with no success. My internet router is 5G Wi-Fi 6,"Not even finding a server. Tried manual local Web address and IP address with no success. My internet router is 5G Wi-Fi 6 -> Connectivity, Server Discovery, Local Network Connectivity"
"Followed the config documentation, works great first go, works from WAN side access fine too (using Nginx Proxy Manager for SSL etc).","Review -> Remote Access, SSL/TLS Encryption, Compatibility"
"Nabu Casa shoved an always-on Assistant into their platform, that you can't disable. They've been asked to add a settings to disable it. They refuse. You're in my private spaces; my phone, my home. But you act like they're yours, not mine. You forget yourselves, I think. Why would I ever trust you again? Get out, you rude, unethical monsters. You should be utterly ashamed of yourselves. The amount of work it's been removing ESPHome from my clients' devices has been staggering. Begone.","Review -> Privacy Settings, Disable Assistant Feature"
"Home Assistant and it's developers work tirelessly to provide a way for devices from multiple brands to truly work together, and Home Assistant is by far the most polished yet customizable attempt so far. A lot of users leaving bad reviews don't seem to understand that this isn't (yet) meant to be a turnkey solution. It's a toolbox for the power user to tinker with their smart home and dial it in exactly the way they want it, which may require some work and light coding along the way.","Review -> Customizability, Compatibility, Automation, Privacy"
"This review is for the WearOS app (not the phone app, which is fantastic.) In a nutshell, it doesn't work for me. I use a non-LTE watch so everything goes through the phone. The watch app needs an option to just communicate THROUGH the Android android app. Instead, it seems to use the android app only for setup, and then attempts to talk directly to Home Assistant. This doesn't work as my HA server requires a VPN. If the watch just let the phone app communicate with HA, it would work.","Review -> Wear OS Compatibility, VPN Support, Communication Protocol"
"This app, along with the core, has only gotten better by the day over my 3 years of use. The last 6 months to a year have seen so much growth. Literally, every day is something to discover, something to learn, and something to share or teach. It not only functions, it works very well! The amount of people and effort given to this project and anything open source is truth and beauty.","Review -> Functionality, Compatibility, Automation, Privacy, Open Standards, Discoverability, Configuration, Performance"
"Recently setup my own Home Assistant using Docker and it is incredibly cool with what the customization allows. I was wondering if the developers of this app could enable the feature to play media from the app, while using other apps. Like if you attempt to play music and switch apps, it will pause and the media isn't recognized by Android in the notification bar. Great app overall.","Review -> Background Media Playback, Notification Bar Integration"
"Great app, really miss ""enable all sensors"" though. It was such an important feature as it's a chore having to enable 60+ sensors one by one manually. Sort of understand why it was removed, but doesn't make it any less inconvenient to everyone that wants to enable all sensors (or most of them) and doesn't justify totally removing that altogether. Should have left it, perhaps with a clear warning and confirmation that battery life will be affected if you enable all sensors. Outside of that one seriously important (to me and others) thing, solid app as always. Hope to have that back though.","Review -> Sensor Enablement, Battery Life"
"Great app. Love all of the recent improvements. As a note, I've found that disabling battery optimization for the app in my phone's system settings helps the location to report properly in the background. I've also found it helps to install GPS Status & Toolbox to improve the location accuracy while in the background. One feature wishlist item- could the battery level be a separate sensor entity like in the iOS app? I use a template sensor now but wouldn't mind not having the extra config.","Review -> Location Reporting, Battery Optimization, Location Accuracy, Sensor Entities, Battery Level Sensor"
"Works great. I feel like the monthly subscription fee for remote access is a little high ($65 USD / ~$100 AUD). I know there's other ways around it, but I'd like to support the project. I'd be happier if it were $40 USD / ~$60 AUD a year.","Review -> Remote Access, Pricing"
"Although home assistant is an excellent product, the mobile experience is obviously not a top priority. The dashboards work fine. Many maintenance things such as writing a template or certain selection boxes are not usable on mobile.","Review -> Mobile Experience, Template Writing, Selection Boxes, Dashboard"
"Home Assistant is so much better for controlling all my smart home stuff. Way more advanced automations, easy to integrate new things, & entirely local! Top tier, love it","Review -> Advanced Automations, Integration Capability, Local Control"
"Good companion app. UPD. App recently started to ignore DoNotDisturb mode and play notification sound, but does not show any notification. In settings I have Show notifications turned On and all notifications Silent.","Review -> Notification Settings, Do Not Disturb Mode"
Select the instance you would like to connect to: That's it. After install that's the only thing that happens. That's the app? Like what am I missing here? *edit* Lol I could have deleted the 1st part of my comment but I will let it stay to show what a noob I am. Now that I realize this was a companion app... I know pretty much nothing about coding but so far I've taken my cameras all my lights and plug ins and Gate opener offline. Yeah I love the app. Wish it was a bit more noob friendly.,"Review -> Ease of Use, Companion App Functionality, Device Connectivity, Automation Capability"
"Home Assistant is absolutely epic platform. However, you still need quite a lot of time to keep it working flawlessly (major releases can contain breaking changes), and a bit of a programming skill (though they are trying to make everything more accessible for regular people). Still, I love it and cannot recommend it enough. I have a ton of devices communicating with each other over Bluetooth, Wi-Fi, Zigbee and Z-Wave, ranging from lights, heating, home security to pretty much everything else.","Review -> Compatibility, Automation, Privacy, Ease of Use, Connectivity Options, Device Integration, Maintenance and Updates"
"Downloaded and installed the app when I got a new phone with a version of Android that would work with it. The application has worked well for me with no real problems but is contingent on you having an understanding of how to set up Home Assistant to do what you want it to do. I am amazed by the commitment of the Home Assistant developers to produce such a polished system which, after a number of years of development, works reliably and consistently. I recommend Home Assistant and this app.","Review -> Compatibility, Reliability, Ease of Setup, Performance"
"Overall a nice app and it has improved this year. But it eats my battery. Both with GPS and other sensors, which cannot be disabled. My home assistant instance is locked down and cloud free, but the amount of tracking (and battery drain) is not acceptable to paranoid me. I would love a simple app that lets me control my HA install from my phone, without all the sensor uploading. But I must go back to my browser and my encrypted tunnel to be happy.","Review -> Battery Life, Sensor Tracking, Data Privacy, App Simplicity"
"This app is just as amazing as Home Assistent itself. You might need a bit of technical knowledge to use it, and the menu structure might be not super intuitive everywhere, but the app is amazingly clean yet powerful. I set up most of HA just via the app and am always happy when opening the app. It seems highly actively maintained. Keep up the amazing work!","Review -> User Interface, Technical Requirements, Maintenance and Updates, Overall User Experience"
"High Accuracy Mode: It doesn't make sense to have an option to turn on high accuracy mode when IN a zone. Zones are stationary and wouldn't need high accuracy. I don't need high accuracy when I'm at home or work. The reverse would be a better option.(Enable high accuracy mode when NOT in zone). I need high accuracy mode for when I'm on the road or traveling. That way when I pull into a zone my automations would trigger instantly like when I pull up to my driveway, then it turn off. Please update","Review -> Location Sharing, Automation, High Accuracy Mode, Zone Detection"
"The application is very good, I've been using it for several years because I have the whole house automated. The only problem is that when you set some notifications to receive on the phone, they work, you receive them, but only if the phone is with the display on or a few minutes after the display is closed. After the phone is not used for a few minutes, notifications are only received when the phone is turned on and the screen is unlocked. All other notifications from other applications is ok","Review -> Notification System, Automation, Mobile App Connectivity"
"IUse your Bluetooth devices attached on your Bluetooth to make shippingist , everyone in your household can that shopping list, keeping it organized, no writing anything down, keeps tracks of appointments, everyday tasks, the weather for your area, can play music whe you're chores Amazon Alexa us greatest","Review -> Voice Assistant, Task Management, Weather Forecast, Music Playback, Bluetooth Connectivity, Smart Home Automation, Appointment Tracking, Organization, Hands-Free Control"
"The best smart home platform available - powerfull and extremely customizable. Want to turn the boiler on when you leave work but only if girlfriend is at home and the cat ate today? You can do that. And more sensible stuff too. This require some setup though- you will have it easier if you have prior experience with raspberry pi or server management, some coding experiance will be good too. This platform is going to a more noobs friendly direction - so it gets easier to use every month!","Review -> Automation, Customization, Remote Access, Conditional Automation"
"Excellent, not only does this app do what you'd expect, while remaining reasonable on battery consumption, but it can (settings, companion app, sensor management) also provide your HA system with much info concerning your phone: if it is charging, % battery, BT and Wifi your phone is connected to, the address where your phone is and more information you may want for Info or for use in automations.","Review -> Battery Consumption, Sensor Management, Automation, Location Sharing, Device Connectivity, Battery Level Monitoring"
Great start to the android app but need location of devices fixing ASAP. The main 2 functions should be to see to see your HA whilst away from your home and also your devices location to let the automations work properly. Currently my phone is not showing on the map but location working in other apps. Often i can leave a location and it wont change for 4 or 5 hours or even days sometimes. Keep up the great work though.,"Review -> Device Location Tracking, Automation, Map View, Location Services"
"Working and stable, looking forward to the bells and whistles! Tracking now added! :-) getting better practically daily!!! Tracking needs some improvement as it often doesn't updated position and will show us as home when we're miles away and vice versa! Now with added widgets! :-)","Review -> Tracking, Widget, Location Sharing, Automation"
"Great first version of this app. Setup is so much easier compared to Ariela, for this app I don't have to write a ""How to set up Home Assistant on Android"" tutorial for my housemates! For the next versions, it would be nice to have a working Home Assistant detection at first use. Keep up the good work and thanks for the first version of this app!","Review -> Setup Process, Home Assistant Detection"
"I'm tentatively giving this 5 stars. The biggest benefit it seems to have over the web interface is that HVEC (h265) RTSP streams actually update live, but only if you click on them, otherwise they have about 30 seconds of lag. Update: goToRTS actually works on the app as well! So HVEC decoding must be built in! If you are having issues with ffmpeg and/or running it on an rpi, this app is the solution! I wish this was documented!","Review -> Live Streaming, RTSP Stream Support, HVEC (h265) Decoding, Lag Time, ffmpeg Compatibility, App Performance on Raspberry Pi"
"The future of Home Automation! We've been involved with wireless and proprietary, closed systems for over 20 years - and in just the last 3 months we've been so impressed with HA and its superb open, truly global and collaborative environment! Lots of learning ofc - but with HA self-sustaining home system there's really no need for expensive, unreliable and closed cloud systems anymore. If you're willing and able, the sky's the limit with HA.","Review -> Open System, Local Control, Automation, Privacy, Compatibility, Cloud Independence"
"Edit: I've been enjoying using this app, so I'm adding a star. I would still like for the app to recognize when I'm connected to WiFi so that it can connect to the host. This is a good start to a Home Assistant mobile companion app, but one function isn't working properly. Home Assistant doesn't use the local address when I'm on WiFi.","Review -> WiFi Connectivity, Local Address Recognition, Home Assistant Connection"
"Like everything else Home Assistant this has been rock solid for me! I can tinker with my environment from the sofa or desk at work whilst my wife can use this with ease as a non technical user. The sensors included in the app have been great for various things. My favourite is the phone state, having my speakers announce an incoming call without the irritation of my obnoxious (through choice) ringtone and triggering location based events","Review -> Remote Access, Sensor Integration, Automation, Notification System, Phone State Sensor, Location-Based Events"
