Review,Feature
The multi-server connection was the most lacking feature to me! Thx for your efforts and such a great product! It would be great to switch between them somehow in visual way but not only by three-finger swipe. I have three servers and i have to switch through them all to get to the target one :),"Review -> Multi-Server Connection, User Interface for Server Switching"
Different options displayed on other sites are extremely confusing,"Review -> Compatibility, Ease of Use, Automation, Data Privacy, Connectivity, Remote Access, Device Control, Notification System, Location Sharing, Sensor Sharing, Voice Assistant, Widget Customization, Smart Home Integration"
Love the way its coming along so far. My only complaints deal with speed and widgets. I have a nice dark theme but the widgets just ruin it by being so bright. I would love to see an option to change widgets to look either dark or transparent. I would also like the app to load quicker if possible.,"Review -> Theme Customization, Application Speed, Widget Customization"
Overall it's pretty great. One easy improvement would be to include a hamburger icon so the menu can fly out. Currently there is a back button that does nothing. Can't access the menu nav as a result...,"Review -> Navigation Menu, Menu Accessibility"
Great work so far! I would like to use toggle widgets for lights but they are useless for me as they don't show current status in any way (they work but the widget looks the same with the light on or off).,"Review -> Toggle Widget, Status Indicator"
"Excellent, powerful platform to control your devices. Providing your willing to go down the rabbit hole there is soo much you can do. There is no issue with certificates, I have mine appropriately configured with a Lets Encrypt SSL and have no issues, do your research.","Review -> Customization, Security, Automation, Compatibility"
It's funny to read all the one star reviews from low IQ door knobs unable to set it up properly. You need at least 60 IQ to do that,"Review -> Ease of Use, Setup Process"
"Color wheel sucks, the steps you have to go through to save colors... ugh, I hate it. Give me the old light bulb interface that was more accessible to colorblind people like myself, and ditch the palette. If I wanted jank I'd use the Google Home App. I do not like forced ui changes, now I have to go fix the UI with customizations to undo the change/find another card. Thanks for that you inconsiderate full color spectrum seeing jerks.","Review -> Color Wheel Interface, Accessibility Features, Customization Options, User Interface"
Absolutely perfect for what it needs to do. Seamless when connected to my local setup and zero problems when any changes are made on my end. All of this coming from a non-programmer.,"Review -> Local Connectivity, Seamless Configuration, Automation, Privacy"
First clicks on buttons typically do nothing,"First clicks on buttons typically do nothing -> Button Responsiveness, User Interface"
I installed it on my raspberry. It works flawlessly and I love having ZigBee bulbs without a physical remote,"I installed it on my raspberry. It works flawlessly and I love having ZigBee bulbs without a physical remote -> Compatibility with Zigbee devices, Device Control"
Works pretty well exept that the bottom card on the dashboard (on smartphone) is hidden. It should scroll a bit more up for the full view.,"Review -> User Interface, Responsiveness, Mobile Optimization"
"nah. ugly, slow and animated","nah. ugly, slow and animated -> User Interface, Performance, Animation"
"Incredibly functional, every single function that the browser version has and remains stable and consistent. Can't praise it enough","Review -> Stability, Consistency, Functionalality"
"All working great and as intended. But I hate the new logo, sorry. Why on earth must every logo of every company/project be revised again and again until only the most basic unrecognizeable geometric shape remains?",Review -> Branding/Logo Design
The out of the box dashboards seem a bit ugly. Otherwise a very well organized and powerful app.,"The out of the box dashboards seem a bit ugly. Otherwise a very well organized and powerful app. -> User Interface, Organization and Customization, Performance"
Love it. Would really like to see the ability to add buttons or entities to the quick settings menu.,Review -> Customization of Quick Settings Menu
